{"$id":"https://closy.local/schemas/v1/closy-executable-d0-research-matrix-threshold-registry-v2.schema.json","$schema":"https://json-schema.org/draft/2020-12/schema","additionalProperties":false,"properties":{"registryId":{"const":"closy.d0_research_matrix.thresholds.v2"},"rows":{"items":{"type":"object"},"minItems":15,"type":"array"},"schemaVersion":{"const":1},"traceability":{"items":{"type":"object"},"minItems":1,"type":"array"}},"required":["schemaVersion","registryId","rows","traceability"],"title":"Closy executable D0 research matrix threshold registry v2","type":"object"}
